B1: 2018.4 | C1: 2018.3 | D1: 2018.2 | E1: 2018.1 | F1: 2017.4 | G1: 2017.3 | H1: 2017.2 | I1: 2017.1 | J1: 2016.4 | K1: 2016.3 | L1: 2016.2 | M1: 2016.1 | N1: 2015.4 | O1: 2015.3 | P1: 2015.2 | Q1: 2015.1 | R1: 2014.4 | S1: 2014.3 | T1: 2014.2 | U1: 2014.1 | V1: 2013.4 | W1: 2013.3 | X1: 2013.2 | Y1: 2013.1 | Z1: 2012.4 | AA1: 2012.3 | AB1: 2012.2 | AC1: 2012.1 | AD1: 2011.4 | AE1: 2011.3 | AF1: 2011.2 | AG1: 2011.1
A2: 国内生产总值（现价）当季值（亿元） | B2: 253598.6 | C2: 229495.5 | D2: 219295.4 | E2: 197920 | F2: 232349 | G2: 209824.1 | H2: 199177.8 | I2: 179403.4 | J2: 209877.2 | K2: 189337.6 | L2: 179878.7 | M2: 160967.3 | N2: 191720.8 | O2: 175803.8 | P2: 167874.5 | Q2: 150593.8 | R2: 180190.3 | S2: 164897.8 | T2: 155922.3 | U2: 140270.2 | V2: 167772.3 | W2: 152222.7 | X2: 143518.7 | Y2: 129449.6 | Z2: 151812 | AA2: 138089.6 | AB2: 131320.6 | AC2: 117357.6 | AD2: 138012.1 | AE2: 126562.2 | AF2: 118895.9 | AG2: 104469.9
A3: 同比名义增速 | B3: =(B2-F2)/F2 -> 9.1455525954490899e-02 | C3: =(C2-G2)/G2 -> 9.3751861678424891e-02 | D3: =(D2-H2)/H2 -> 0.10100322425491198 | E3: =(E2-I2)/I2 -> 0.10321209074075523 | F3: =(F2-J2)/J2 -> 0.10707118257724034 | G3: =(G2-K2)/K2 -> 0.10820090674012979 | H3: =(H2-L2)/L2 -> 0.10728952343996247 | I3: =(I2-M2)/M2 -> 0.11453320022141147 | J3: =(J2-N2)/N2 -> 9.4702296255805438e-02 | K3: =(K2-O2)/O2 -> 7.6982408798899782e-02 | L3: =(L2-P2)/P2 -> 7.1506988851791145e-02 | M3: =(M2-Q2)/Q2 -> 6.8883977959251982e-02 | N3: =(N2-R2)/R2 -> 6.3990680963403698e-02 | O3: =(O2-S2)/S2 -> 6.6137935133155204e-02 | P3: =(P2-T2)/T2 -> 7.6654846676838487e-02 | Q3: =(Q2-U2)/U2 -> 7.3597955945025925e-02 | R3: =(R2-V2)/V2 -> 7.4016986117493772e-02 | S3: =(S2-W2)/W2 -> 8.3266818943560819e-02 | T3: =(T2-X2)/X2 -> 8.6424974585193257e-02 | U3: =(U2-Y2)/Y2 -> 8.3589288804291437e-02 | V3: =(V2-Z2)/Z2 -> 0.10513200537506909 | W3: =(W2-AA2)/AA2 -> 0.10234731652492299 | X3: =(X2-AB2)/AB2 -> 9.2887939896710833e-02 | Y3: =(Y2-AC2)/AC2 -> 0.10303550856527399 | Z3: =(Z2-AD2)/AD2 -> 9.9990508078639434e-02 | AA3: =(AA2-AE2)/AE2 -> 9.1080907253508619e-02 | AB3: =(AB2-AF2)/AF2 -> 0.10450065982090226 | AC3: =(AC2-AG2)/AG2 -> 0.1233628059374041
A4: 国内生产总值（不变价）当季值（亿元） | B4: 232264.9 | C4: 213043.8 | D4: 204077.2 | E4: 183613 | F4: 218393.3 | G4: 200133.4 | H4: 191284.6 | I4: 171852.5 | J4: 204764.2 | K4: 187498.6 | L4: 179089.5 | M4: 160837.9 | N4: 169488.4 | O4: 153127.4 | P4: 146898.4 | Q4: 132491.5 | R4: 158668.8 | S4: 143294.9 | T4: 137305 | U4: 123850.1 | V4: 147965.2 | W4: 133751.6 | X4: 127743.9 | Y4: 115342.5 | Z4: 137370.4 | AA4: 123917 | AB4: 118757.4 | AC4: 106938.5 | AD4: 127039.6 | AE4: 115223.5 | AF4: 110314.2 | AG4: 98902.8
A5: 同比实际增速 | B5: =(B4-F4)/F4 -> 6.351660055505369e-02 | C5: =(C4-G4)/G4 -> 6.4508972515332247e-02 | D5: =(D4-H4)/H4 -> 6.6877312653501664e-02 | E5: =(E4-I4)/I4 -> 6.8433685864331337e-02 | F5: =(F4-J4)/J4 -> 6.6559974839351679e-02 | G5: =(G4-K4)/K4 -> 6.7386103149570123e-02 | H5: =(H4-L4)/L4 -> 6.8095002777940672e-02 | I5: =(I4-M4)/M4 -> 6.8482615105021932e-02 | J5: =(J4-N4)/N4 -> 0.20813105793670847 | K5: =(K4-O4)/O4 -> 0.22446146150199123 | L5: =(L4-P4)/P4 -> 0.21913853384379958 | M5: =(M4-Q4)/Q4 -> 0.21394881935822294 | N5: =(N4-R4)/R4 -> 6.8189839464343371e-02 | O5: =(O4-S4)/S4 -> 6.8617236203102838e-02 | P5: =(P4-T4)/T4 -> 6.986926914533334e-02 | Q5: =(Q4-U4)/U4 -> 6.9773056299510403e-02 | R5: =(R4-V4)/V4 -> 7.2338630975391352e-02 | S5: =(S4-W4)/W4 -> 7.1350922157192798e-02 | T5: =(T4-X4)/X4 -> 7.4845843911137883e-02 | U5: =(U4-Y4)/Y4 -> 7.3759455534603516e-02 | V5: =(V4-Z4)/Z4 -> 7.7125785467611785e-02 | W5: =(W4-AA4)/AA4 -> 7.9364413276628756e-02 | X5: =(X4-AB4)/AB4 -> 7.5671073970969394e-02 | Y5: =(Y4-AC4)/AC4 -> 7.8587225367851621e-02 | Z5: =(Z4-AD4)/AD4 -> 8.131952556525672e-02 | AA5: =(AA4-AE4)/AE4 -> 7.5449018646369881e-02 | AB5: =(AB4-AF4)/AF4 -> 7.6537744007571074e-02 | AC5: =(AC4-AG4)/AG4 -> 8.1248458082076508e-02
A6: 环比增速（%） | B6: 1.5 | C6: 1.6 | D6: 1.7 | E6: 1.5 | F6: 1.5 | G6: 1.7 | H6: 1.8 | I6: 1.5 | J6: 1.6 | K6: 1.7 | L6: 1.9 | M6: 1.4 | N6: 1.5 | O6: 1.7 | P6: 1.8 | Q6: 1.8 | R6: 1.7 | S6: 1.8 | T6: 1.8 | U6: 1.8 | V6: 1.6 | W6: 2.1 | X6: 1.8 | Y6: 1.9 | Z6: 2 | AA6: 1.8 | AB6: 2.1 | AC6: 2